{
  "schema": "sentinel-coverage/draft-1",
  "id": "cov-2",
  "runId": "run-1",
  "checkId": "chk-1",
  "workId": "work-pattern-api",
  "workRevision": 2,
  "granularity": "aggregate",
  "assessedScopeArtifact": "sha256:1111111111111111111111111111111111111111111111111111111111111111",
  "limitationsArtifact": "sha256:2222222222222222222222222222222222222222222222222222222222222222",
  "recordedAt": "2026-10-21T12:05:00.250Z",
  "status": "complete",
  "basis": {
    "kind": "reused",
    "publication": {
      "id": "work-pattern-api",
      "revision": 1
    },
    "derivationArtifact": "sha256:7777777777777777777777777777777777777777777777777777777777777777"
  },
  "skipped": []
}
